Job Title,Job Description,Role
Data Scientist,"Analyze data, build models, and derive insights using Python, SQL, and ML frameworks.",Data Science
Software Engineer,"Develop software applications using Java, Python, and web technologies.",Software Development
Cloud Engineer,"Manage cloud infrastructure, automate deployments, and ensure scalability.",Cloud
AI Researcher,"Conduct research in AI, build deep learning models, and publish findings.",AI
Business Analyst,"Interpret data, generate reports, and provide insights to support business decisions.",Analytics
